{
  "activationRequest": {
    "activationAttemptId": "90909090-9090-4090-8090-909090909090"
  },
  "activationResponse": {
    "entry": {
      "objectType": "CanvasEntry",
      "contractVersion": "0.2",
      "handle": "ce_ABCDEFGHIJKLMNOPQRSTUVWXYZabcdef",
      "tenantId": "11111111-1111-4111-8111-111111111111",
      "projectId": "22222222-2222-4222-8222-222222222222",
      "packageId": "33333333-3333-4333-8333-333333333333",
      "state": "active",
      "issuedAt": "2026-08-14T02:00:00.000Z",
      "expiresAt": "2026-08-14T02:02:00.000Z"
    },
    "replayed": false,
    "requestId": "req-canvas-activation-001"
  },
  "legacyOpenRequest": {
    "handle": "ce_ABCDEFGHIJKLMNOPQRSTUVWXYZabcdef",
    "tenantId": "11111111-1111-4111-8111-111111111111",
    "projectId": "22222222-2222-4222-8222-222222222222",
    "packageId": "33333333-3333-4333-8333-333333333333"
  },
  "legacyOpenResponse": {
    "schemaVersion": "pilot-canvas-bootstrap.v1",
    "status": "ready",
    "projectId": "22222222-2222-4222-8222-222222222222",
    "packageId": "33333333-3333-4333-8333-333333333333",
    "canvasSessionId": "pcs_ABCDEFGHIJKLMNOPQRSTUVWX12345678",
    "expiresAt": "2026-08-14T02:02:00.000Z",
    "requestId": "req-canvas-open-001"
  },
  "formalBootstrapResponse": {
    "objectType": "CanvasBootstrap",
    "contractVersion": "0.1",
    "tenantId": "11111111-1111-4111-8111-111111111111",
    "projectId": "22222222-2222-4222-8222-222222222222",
    "packageId": "33333333-3333-4333-8333-333333333333",
    "canvasSessionId": "pcs_ABCDEFGHIJKLMNOPQRSTUVWX12345678",
    "status": "ready",
    "approvedScript": {
      "scriptId": "44444444-4444-4444-8444-444444444444",
      "version": 3,
      "status": "approved"
    },
    "approvedStoryboard": {
      "storyboardId": "55555555-5555-4555-8555-555555555555",
      "version": 2,
      "status": "approved"
    },
    "document": {
      "documentId": "77777777-7777-4777-8777-777777777777",
      "version": 4
    },
    "assetSummaries": [
      {
        "assetId": "88888888-8888-4888-8888-888888888888",
        "category": "virtual_character",
        "displayName": "门店讲解员",
        "rightsStatus": "authorized",
        "approvalStatus": "approved",
        "providerStatus": "active",
        "entityBindingStatus": "approved",
        "controlledPreviewUrl": "/api/canvas-v1/assets/88888888-8888-4888-8888-888888888888/preview"
      }
    ],
    "capabilities": [
      {
        "capability": "video_generation",
        "available": true,
        "reasonCode": null
      },
      {
        "capability": "playlist_export",
        "available": false,
        "reasonCode": "CAPABILITY_UNAVAILABLE"
      }
    ],
    "requestId": "req-canvas-bootstrap-001",
    "occurredAt": "2026-08-14T02:00:00.000Z"
  },
  "approvalPrepareRequest": {
    "packageId": "33333333-3333-4333-8333-333333333333",
    "canvasSessionId": "pcs_ABCDEFGHIJKLMNOPQRSTUVWX12345678",
    "commandType": "GENERATE_SHOT",
    "action": {
      "commandId": "dddddddd-dddd-4ddd-8ddd-dddddddddddd",
      "payload": {
        "shotId": "66666666-6666-4666-8666-666666666666",
        "readinessId": "cccccccc-cccc-4ccc-8ccc-cccccccccccc",
        "prompt": "店员在门店入口介绍招牌套餐，镜头稳定。",
        "referenceAssetIds": [
          "88888888-8888-4888-8888-888888888888"
        ]
      }
    },
    "expiresInSeconds": 60,
    "replayPolicy": "single_use_replay_same_command"
  },
  "approvalPrepareResponse": {
    "approvalId": "eeeeeeee-eeee-4eee-8eee-eeeeeeeeeeee",
    "status": "active"
  },
  "commandDispatchRequest": {
    "objectType": "CanvasCommand",
    "contractVersion": "0.1",
    "tenantId": "11111111-1111-4111-8111-111111111111",
    "projectId": "22222222-2222-4222-8222-222222222222",
    "packageId": "33333333-3333-4333-8333-333333333333",
    "canvasSessionId": "pcs_ABCDEFGHIJKLMNOPQRSTUVWX12345678",
    "commandId": "dddddddd-dddd-4ddd-8ddd-dddddddddddd",
    "commandType": "GENERATE_SHOT",
    "requestedByActorId": "12121212-1212-4212-8212-121212121212",
    "requestSource": "user",
    "approvalId": "eeeeeeee-eeee-4eee-8eee-eeeeeeeeeeee",
    "payload": {
      "shotId": "66666666-6666-4666-8666-666666666666",
      "readinessId": "cccccccc-cccc-4ccc-8ccc-cccccccccccc",
      "prompt": "店员在门店入口介绍招牌套餐，镜头稳定。",
      "referenceAssetIds": [
        "88888888-8888-4888-8888-888888888888"
      ]
    },
    "requestId": "req-canvas-command-001",
    "occurredAt": "2026-08-14T02:02:00.000Z"
  }
}
